{"format":"axiom-semantic-bootstrap-summary-v1","formatVersion":1,"authority":"GT-G0-14_BOOTSTRAP_ONLY","scope":"POC01_HOST_CORE_OPERATION_REPLAY_DIGEST_PROJECTION","sourceCommit":"WORKTREE","status":"PASS","tests":["canvas_poc01_core_tests"],"corpusSha256":"aaaaaaaaaaaaaaaaaaaaaaaaaaaaaaaaaaaaaaaaaaaaaaaaaaaaaaaaaaaaaaaa","limitations":["NOT_G1_SEMANTIC_ACCEPTANCE"]}
